{
  "schema_version": "1.0",
  "experiment_id": "generated-pg-full-loop-bundle",
  "family_id": "generated.pg_full_loop_bundle",
  "engine": "primitive_generated_substrate",
  "description": "Attempted full six-primitive substrate built from the rewrite bundle and a causal packaging loop.",
  "parameters": {
    "bundle_origin": "pg.full_loop_bundle",
    "active_cells": [
      "P1<-P3",
      "P2<-P1",
      "P3<-P4",
      "P4<-P3",
      "P5<-P4",
      "P6<-P5"
    ],
    "primitive_coverage": [
      "P1",
      "P2",
      "P3",
      "P4",
      "P5",
      "P6"
    ],
    "steps_run": 10,
    "frozen_generation": {
      "stable_rule_family": true,
      "closure_idempotence_defect": 0.255,
      "induced_core_type": "finite_state_renewal_like",
      "return_time_regime": "bounded_constant",
      "effective_alphabet_regime": "finite_large",
      "return_structure": "richer",
      "constraint_only_share": 0.12,
      "multi_primitive_interaction_score": 6,
      "status": "promising",
      "classification_note": "Attempted full six-primitive loop; packaging enters the loop but still behaves like observational bookkeeping rather than a causally indispensable primitive.",
      "causal_roles": {
        "P1": "active",
        "P2": "active",
        "P3": "active",
        "P4": "active",
        "P5": "observational",
        "P6": "active"
      },
      "final_state": {
        "budget": 4.0,
        "map_count": 7,
        "phase": 1,
        "maps": [
          {
            "label": "exit_left",
            "domain": [0.0, 0.16],
            "a": 0.4012,
            "b": 0.0194,
            "weight": 1.08,
            "return_length": 1
          },
          {
            "label": "exit_right",
            "domain": [0.14, 0.33],
            "a": 0.3821,
            "b": 0.1184,
            "weight": 1.02,
            "return_length": 1
          },
          {
            "label": "wait_hold",
            "domain": [0.27, 0.57],
            "a": 0.5229,
            "b": 0.101,
            "weight": 1.18,
            "return_length": 2
          },
          {
            "label": "return_branch",
            "domain": [0.4, 0.68],
            "a": 0.314,
            "b": 0.002,
            "weight": 1.01,
            "return_length": 1
          },
          {
            "label": "bridge",
            "domain": [0.54, 0.79],
            "a": 0.445,
            "b": 0.052,
            "weight": 1.04,
            "return_length": 2
          },
          {
            "label": "pack_retention",
            "domain": [0.49, 0.74],
            "a": 0.468,
            "b": 0.063,
            "weight": 0.97,
            "return_length": 2
          },
          {
            "label": "wait_hold_amp",
            "domain": [0.43, 0.6],
            "a": 0.512,
            "b": 0.109,
            "weight": 1.11,
            "return_length": 2
          }
        ]
      }
    }
  },
  "run_controls": {
    "save_outputs": false,
    "seed": 0
  },
  "output_root": "results/full_six_primitive_closure/generated/pg_full_loop_bundle"
}
