{
  "schema_version": "1.0",
  "experiment_id": "restricted-digits-base4-02-baseline",
  "family_id": "classical.restricted_digits_base4_02",
  "engine": "classical_similarity",
  "description": "Base-4 restricted digits {0,2} similarity baseline.",
  "parameters": {
    "base": 4,
    "allowed_digits": [
      0,
      2
    ],
    "max_depth": 8
  },
  "run_controls": {
    "seed": 0,
    "precision_bits": 53,
    "save_outputs": true
  },
  "output_root": "results/classical_baselines/restricted_digits_base4_02"
}
