{
  "schema_version": "1.0",
  "experiment_id": "generated-pg-rewrite-bundle",
  "family_id": "generated.pg_rewrite_bundle",
  "engine": "primitive_generated_substrate",
  "description": "Frozen generated substrate from SB-T1 rewrite bundle.",
  "parameters": {
    "bundle_origin": "pg.rewrite_bundle",
    "active_cells": [
      "P1<-P5",
      "P2<-P5",
      "P3<-P4",
      "P4<-P3",
      "P5<-P3",
      "P5<-P4",
      "P5<-P6",
      "P6<-P5"
    ],
    "primitive_coverage": [
      "P1",
      "P2",
      "P3",
      "P4",
      "P6"
    ],
    "steps_run": 8,
    "frozen_generation": {
      "stable_rule_family": true,
      "closure_idempotence_defect": 0.12,
      "induced_core_type": "finite_state_renewal_like",
      "return_time_regime": "bounded_constant",
      "effective_alphabet_regime": "finite_large",
      "return_structure": "richer",
      "constraint_only_share": 0.08,
      "multi_primitive_interaction_score": 6,
      "status": "promising",
      "classification_note": "Primitive rewrite/protocol/audit bundle with active P5 packaging that now drives rewrite and gating in the same loop.",
      "p5_causal_status": "closed",
      "packaging_producers": [
        "P5<-P3",
        "P5<-P4",
        "P5<-P6"
      ],
      "packaging_selector": "hysteresis_best_score",
      "p1_from_p5_rule": "rewrite targets follow the active packaging boundaries and package defect score.",
      "p2_from_p5_rule": "gating follows package viability and cross-package leakage under the selected packaging.",
      "causal_roles": {
        "P1": "active",
        "P2": "active",
        "P3": "active",
        "P4": "active",
        "P5": "active",
        "P6": "active"
      },
      "final_state": {
        "budget": 4.0,
        "map_count": 8,
        "phase": 0,
        "maps": [
          {
            "label": "exit_left",
            "domain": [0.0, 0.18],
            "a": 0.40944,
            "b": 0.02096,
            "weight": 1.09,
            "return_length": 1
          },
          {
            "label": "exit_right",
            "domain": [0.15, 0.34],
            "a": 0.37998,
            "b": 0.11976,
            "weight": 1.05,
            "return_length": 1
          },
          {
            "label": "wait_hold",
            "domain": [0.28, 0.58],
            "a": 0.524432,
            "b": 0.1,
            "weight": 1.23178,
            "return_length": 2
          },
          {
            "label": "return_branch",
            "domain": [0.4, 0.7],
            "a": 0.31124,
            "b": 0.0012,
            "weight": 1.02,
            "return_length": 1
          },
          {
            "label": "bridge",
            "domain": [0.56, 0.82],
            "a": 0.447286,
            "b": 0.051193,
            "weight": 1.067861,
            "return_length": 2
          },
          {
            "label": "wait_hold_amp",
            "domain": [0.43, 0.58],
            "a": 0.516521,
            "b": 0.105928,
            "weight": 1.115259,
            "return_length": 2
          },
          {
            "label": "package_left",
            "domain": [0.09, 0.24],
            "a": 0.4011,
            "b": 0.0311,
            "weight": 1.03,
            "return_length": 2
          },
          {
            "label": "package_right",
            "domain": [0.68, 0.9],
            "a": 0.4382,
            "b": 0.0542,
            "weight": 0.99,
            "return_length": 2
          }
        ]
      }
    }
  },
  "run_controls": {
    "save_outputs": false,
    "seed": 0
  },
  "output_root": "results/lawful_substrate_diagnostics/generated/pg_rewrite_bundle"
}
