{
  "schema_version": "1.0",
  "experiment_id": "generated-continuous-full-loop-kernel",
  "family_id": "generated.continuous_full_loop_kernel",
  "engine": "continuous_kernel_substrate",
  "description": "Frozen working continuous full-loop kernel from SB-R3.",
  "parameters": {
    "steps_run": 1000,
    "kernel_dim": 16,
    "seed": 17,
    "pilot_parameters": {
      "lens_hysteresis": 0.025,
      "packaging_hysteresis": 0.018,
      "budget_income_scale": 1.0,
      "budget_cost_scale": 1.0,
      "tau_initial": 1.0,
      "action_temperature_bias": 0.0,
      "lens_temperature_shift": 0.0
    },
    "primitive_activity": {
      "P1": true,
      "P2": true,
      "P3": true,
      "P4": true,
      "P5": true,
      "P6": true
    },
    "frozen_generation": {
      "regime_label": "lawful_exploratory",
      "continuous_full_loop_status": "working",
      "working_class_id": "continuous_full_loop_lawful_kernel_class"
    }
  },
  "run_controls": {
    "save_outputs": false
  },
  "output_root": "results/continuous_theorem_assumptions/generated/continuous_full_loop_kernel"
}

